<?xml version="1.0" encoding="UTF-8"?>
<richieste xmlns:xsi="http://www.w3.org/2001/XMLSchema-instance" xsi:noNamespaceSchemaLocation="../schema/schemaRichiesteRicariche.xsd"><ricarica id="1" id_cliente="4" stato="A" id_admin="1"><data_richiesta>2024-07-26</data_richiesta><crediti_richiesti>100</crediti_richiesti></ricarica><ricarica id="2" id_cliente="4" stato="A" id_admin="1"><data_richiesta>2024-07-26</data_richiesta><crediti_richiesti>40</crediti_richiesti></ricarica><ricarica id="3" id_cliente="4" stato="A" id_admin="1"><data_richiesta>2024-07-26</data_richiesta><crediti_richiesti>100</crediti_richiesti></ricarica><ricarica id="4" id_cliente="4" stato="A" id_admin="1"><data_richiesta>2024-07-26</data_richiesta><crediti_richiesti>100</crediti_richiesti></ricarica><ricarica id="5" id_cliente="4" stato="A" id_admin="1"><data_richiesta>2024-07-26</data_richiesta><crediti_richiesti>100</crediti_richiesti></ricarica><ricarica id="6" id_cliente="4" stato="A" id_admin="1"><data_richiesta>2024-07-26</data_richiesta><crediti_richiesti>100</crediti_richiesti></ricarica><ricarica id="7" id_cliente="3" stato="W"><data_richiesta>2024-07-26</data_richiesta><crediti_richiesti>40</crediti_richiesti></ricarica></richieste>
